id,customer_id,timestamp,question,category,sentiment,priority,department,answer,reference,satisfaction,status,notes
Q033,C195,2025-04-16 08:55:14,ช่องทางการติดต่อฝ่ายบริการลูกค้ามีที่ไหนบ้าง?,ข้อมูลทั่วไป,เป็นกลาง,ต่ำ,ฝ่ายบริการลูกค้า,"คุณสามารถติดต่อเราได้หลายช่องทาง ได้แก่ โทรศัพท์ 02-123-4567 (ทุกวัน 8.00-20.00 น.), ไลน์ @servicecenter, อีเมล help@example.com, แชทในเว็บไซต์หรือแอพของเรา หรือติดต่อที่เคาน์เตอร์บริการลูกค้าที่สาขาทุกแห่ง",FAQ050,5,แก้ไขแล้ว,NULL
Q034,C198,2025-04-16 09:45:21,อยากทราบเวลาทำการของสาขาเซ็นทรัลลาดพร้าว,ข้อมูลทั่วไป,เป็นกลาง,ต่ำ,ฝ่ายบริการลูกค้า,สาขาเซ็นทรัลลาดพร้าวเปิดให้บริการทุกวัน เวลา 10:00 - 22:00 น. วันหยุดนักขัตฤกษ์อาจมีการเปลี่ยนแปลง สามารถตรวจสอบเวลาทำการล่าสุดได้ที่เว็บไซต์หรือแอพของเรา,FAQ040,5,แก้ไขแล้ว,NULL
Q035,C251,2025-04-16 12:20:35,มีสินค้าให้ทดลองใช้ก่อนซื้อไหม?,สินค้า,เป็นกลาง,ปานกลาง,ฝ่ายขาย,เรามีบริการทดลองใช้สินค้าที่สาขาทุกแห่งสำหรับอุปกรณ์อิเล็กทรอนิกส์ เครื่องใช้ไฟฟ้า และสินค้าเครื่องสำอาง นอกจากนี้ สำหรับสินค้าบางรายการเรายังมีโปรแกรมทดลองใช้ที่บ้าน 7 วัน โดยมีเงื่อนไขการวางมัดจำ คุณสามารถสอบถามรายละเอียดเพิ่มเติมได้ที่พนักงานขาย,FAQ055,4,แก้ไขแล้ว,NULL
Q036,C279,2025-04-16 15:40:19,มีบริการซ่อมนอกสถานที่หรือไม่? เครื่องซักผ้าเสียไม่สามารถขนมาที่ศูนย์ได้,บริการซ่อม,เป็นกลาง,ปานกลาง,ฝ่ายเทคนิค,เรามีบริการซ่อมนอกสถานที่สำหรับเครื่องใช้ไฟฟ้าขนาดใหญ่ เช่น เครื่องซักผ้า ตู้เย็น และเครื่องปรับอากาศ คุณสามารถนัดหมายช่างได้ผ่านแอปพลิเคชัน เว็บไซต์ หรือโทรศัพท์ 02-123-4567 ค่าบริการเริ่มต้นที่ 500 บาท (ไม่รวมค่าอะไหล่) และอาจมีค่าใช้จ่ายเพิ่มเติมขึ้นอยู่กับระยะทางและความซับซ้อนของงาน,FAQ060,5,แก้ไขแล้ว,NULL
Q037,C357,2025-04-17 15:30:42,ขอบคุณสำหรับการแก้ไขปัญหาอย่างรวดเร็วมาก ประทับใจการบริการมากๆ,ข้อเสนอแนะ,เชิงบวก,ต่ำ,ฝ่ายบริหาร,ขอบคุณสำหรับคำชมเชย ทางเรายินดีเป็นอย่างยิ่งที่ได้ช่วยเหลือและคุณพึงพอใจกับการบริการ หวังว่าจะได้บริการคุณอีกในโอกาสถัดไป,KB001,5,แก้ไขแล้ว,NULL
Q038,C207,2025-04-17 11:25:37,อยากให้มีบริการจัดส่งในวันเดียวกับที่สั่ง,ข้อเสนอแนะ,เป็นกลาง,ต่ำ,ฝ่ายบริหาร,ขอบคุณสำหรับคำแนะนำ ทางเรากำลังพัฒนาบริการจัดส่งในวันเดียวกันสำหรับพื้นที่ในกรุงเทพฯและปริมณฑล คาดว่าจะเริ่มให้บริการได้ภายในไตรมาสหน้า เราจะแจ้งให้ทราบเมื่อบริการนี้พร้อมให้บริการ,KB060,4,กำลังดำเนินการ,NULL
Q039,C184,2025-04-18 10:30:22,ขอคำแนะนำเกี่ยวกับผลิตภัณฑ์ที่เหมาะกับผิวแพ้ง่าย,สินค้า,เป็นกลาง,ต่ำ,ฝ่ายผลิตภัณฑ์,"สำหรับผิวแพ้ง่าย เราแนะนำผลิตภัณฑ์ในกลุ่ม 'Sensitive Skin' ที่ปราศจากน้ำหอมและแอลกอฮอล์ ได้แก่ รหัสสินค้า SK101, SK105 และ SK110 ซึ่งผ่านการทดสอบโดยผู้เชี่ยวชาญด้านผิวหนัง",KB032,5,แก้ไขแล้ว,NULL
Q040,C192,2025-04-18 14:15:39,ต้องการคำแนะนำในการเลือกโทรทัศน์ที่เหมาะกับห้องขนาดเล็ก,สินค้า,เป็นกลาง,ต่ำ,ฝ่ายผลิตภัณฑ์,สำหรับห้องขนาดเล็ก เราแนะนำทีวีขนาด 32-43 นิ้ว ซึ่งเหมาะกับระยะการรับชมประมาณ 1-2.5 เมตร รุ่นที่เป็นที่นิยมได้แก่ STV-32A ที่มาพร้อมระบบเสียงคุณภาพสูงในขนาดกะทัดรัด หรือ LTV-43B ที่มีขอบจอบางและติดตั้งแบบแขวนได้เพื่อประหยัดพื้นที่ คุณสามารถดูรายละเอียดเพิ่มเติมหรือทดลองชมได้ที่สาขาใกล้บ้าน,KB065,5,แก้ไขแล้ว,NULL